{"acceptance":null,"backend":"metal","baselineId":"production-content-lantern-v3.metal.macos.apple8.metal.rgba8","calibrationEvidenceSha256":"2d01b1f61f24895483ed8ae0033efaeea5bbb42a02b42a1f84c876a2a4d0f1cb","capabilityDigest":"e4478a44f3fb742aafe0f17f836b2afc0736ea827a651be578f220570c7c046c","compressedSha256":"7a3c6aaac225471a408a27b1457df0848818ec03b587091e19279e8a25afb49b","decodedSha256":"a5772a59ecda027bd0898d6982a38435382f6e5e630de11a11d9d4c6806469fb","deviceClass":"macos.apple8.metal.rgba8","exposureStops":0,"flipPolicy":{"badPixelFractionMax":0.001,"badPixelThreshold":0.05,"maximumMax":0.01,"meanMax":0.0005,"p95Max":0.001},"height":512,"outputDeviceProfileId":"Sdr.sRGB.v1","referencePath":"production-content-lantern-v3-metal-macos.apple8.metal.rgba8-candidate.png","sampleCount":1,"schema":"stoner.sdr-image-baseline","schemaVersion":3,"settingsDigest":"2e9ec7a45efe6537db4e806e05cca54043d4a841aa013c67c941866e35d20d34","state":"candidate","transformVersion":"Sdr.KhronosPbrNeutral.v1","width":512,"workloadRevision":"production-content-lantern-v3"}
