{"acceptance":null,"backend":"metal","baselineId":"production-content-sponza-v3.metal.macos.apple8.metal.rgba8","calibrationEvidenceSha256":"7cb16671e4d1bb38f00ea85dcc45560017d9ad476501a9a27f124cb5dc361815","capabilityDigest":"9c1b89b085618b275f60166e5069aa1650f8f904d4b976500c93445bbfd43ec6","compressedSha256":"4f72c4871fe51280f7db47f026059ca31150b2130d9f53f0d65eb9281eb249e7","decodedSha256":"98d26a5201f6d8294d0e9162ee2f006ec820dd243dc7b1ce2c3efe52d26e7fee","deviceClass":"macos.apple8.metal.rgba8","exposureStops":0,"flipPolicy":{"badPixelFractionMax":0.001,"badPixelThreshold":0.05,"maximumMax":0.01,"meanMax":0.0005,"p95Max":0.001},"height":512,"outputDeviceProfileId":"Sdr.sRGB.v1","referencePath":"production-content-sponza-v3-metal-macos.apple8.metal.rgba8-candidate.png","sampleCount":1,"schema":"stoner.sdr-image-baseline","schemaVersion":3,"settingsDigest":"2e9ec7a45efe6537db4e806e05cca54043d4a841aa013c67c941866e35d20d34","state":"candidate","transformVersion":"Sdr.KhronosPbrNeutral.v1","width":512,"workloadRevision":"production-content-sponza-v3"}
