{"acceptance":null,"backend":"vulkan","baselineId":"production-content-sponza-v3.vulkan.windows.discrete-vulkan.rgba8","calibrationEvidenceSha256":"dca4e41a117767f41b78760acea1277324110b305cdcca7e205581e381f25975","capabilityDigest":"c7cfed63c497d185858cb2f4bf693b568eb1df940d1b261a7cc4146b0fd7b03d","compressedSha256":"6d93309e0bd939a85e6c8bcf6d4251de6e1e6b54b0ce25699f1867648a982950","decodedSha256":"d85636cd7b43846ec60290379456b5258a811570b162ee6b0d2b0a49b37ddbe5","deviceClass":"windows.discrete-vulkan.rgba8","exposureStops":0,"flipPolicy":{"badPixelFractionMax":0.001,"badPixelThreshold":0.05,"maximumMax":0.01,"meanMax":0.0005,"p95Max":0.001},"height":512,"outputDeviceProfileId":"Sdr.sRGB.v1","referencePath":"production-content-sponza-v3-vulkan-windows.discrete-vulkan.rgba8-candidate.png","sampleCount":1,"schema":"stoner.sdr-image-baseline","schemaVersion":3,"settingsDigest":"2e9ec7a45efe6537db4e806e05cca54043d4a841aa013c67c941866e35d20d34","state":"candidate","transformVersion":"Sdr.KhronosPbrNeutral.v1","width":512,"workloadRevision":"production-content-sponza-v3"}
